‾	винкулум, горна черта
_	долна черта, долно тире, линия, подчертаване, тире
-	минус, тире
‐	дефис, тире
–	средно, средно тире, тире
—	дълго, дълго тире, тире
―	линия, тире, хоризонтална черта, черта
・	интерпункт, катакана, средна точка, средна точка в катакана, точки
,	запетая
،	арабска, арабска запетая, запетая
、	запетая, идеографска, идеографска запетая
;	точка и запетая
؛	арабска, арабска точка и запетая, точка и запетая
:	двоеточие
!	възклицание, удар, удивителен знак
¡	възклицание, обърнат, обърнат удивителен знак, удар, удивителен знак, удивителна
?	въпрос, въпросителен знак
¿	въпрос, въпросителен знак, обърнат, обърнат въпросителен знак
؟	арабски, арабски въпросителен знак, въпрос, въпросителен знак
‽	интеробанг, удивителна с въпросителна
.	точка
…	изпускане, многоточие, три точки
。	идеографска, идеографска точка, точка
·	интерпункт, средна, средна точка, точка
'	апостроф, единични кавички, кавички, прав апостроф
‘	апостроф, единични кавички, кавички, ляв апостроф
’	апостроф, десен апостроф, единични кавички, кавички
‚	апостроф, долен десен апостроф, долна кавичка, кавички
“	двойни кавички, кавички, леви кавички
”	апостроф, двойни кавички, десни кавички, кавички
„	двойни кавички, долни десни кавички, долни кавички, кавички
«	кавичка, кавички, карета, лява френска кавичка, ляво, шеврон, ъгъл
»	дясна френска кавичка, дясно, кавичка, кавички, карета, шеврон, ъгъл
)	затваряща скоба, кръгла скоба, скоба, стандартна скоба
[	квадратна скоба, отваряща квадратна скоба, скоба, структурна скоба
]	затваряща квадратна скоба, квадратна скоба, скоба, структурна скоба
{	къдрава скоба, отваряща къдрава скоба, скоба, фигурна скоба
}	затваряща къдрава скоба, къдрава скоба, скоба, фигурна скоба
〈	остра скоба, отваряща ъглеста скоба, скоба, ъглеста скоба
〉	затваряща ъглеста скоба, остра скоба, скоба, ъглеста скоба
《	двойна ъглеста скоба, отваряща двойна ъглеста скоба, скоба
》	двойна ъглеста скоба, затваряща двойна ъглеста скоба, скоба
「	горна скоба, отваряща горна скоба, скоба
」	долна скоба, затваряща долна скоба, скоба
『	бяла горна скоба, отваряща бяла горна скоба, скоба
』	бяла долна скоба, затваряща бяла долна скоба, скоба
【	квадратна вдлъбната скоба, отваряща черна квадратна вдлъбната скоба, скоба
】	затваряща черна квадратна вдлъбната скоба, квадратна вдлъбната скоба, скоба
〔	отваряща скоба със скосени краища, скоба, скоба със скосени краища
〕	затваряща скоба със скосени краища, скоба, скоба със скосени краища
〖	бяла квадратна вдлъбната скоба, отваряща бяла квадратна вдлъбната скоба, скоба
〗	бяла квадратна вдлъбната скоба, затваряща бяла квадратна вдлъбната скоба, скоба
§	параграф, подразделение, секция, част
¶	абзац, знак за абзац, нов раздел, параграф
@	знак за имейл, кльомба, маймунка, маймунско „а“
*️	астериск, заместващ знак, звездица, звездичка
/	диагонална черта, наклонена черта, слаш
\	обратна диагонална черта, обратна наклонена черта, слаш
&	амперсанд, и
#️	диез, знак диез, номер, паунд, хаштаг
%	процент
‰	една десета част от процента, една хилядна, промил
†	кръст, обел, обелиск
‡	двоен, двоен обелиск, кръст, обел, обелиск
•	водещ символ, точка
‧	дефис, тире, точка, точка за разделяне на срички
′	прим
″	двоен прим, прим
‴	прим, троен прим
‸	карета
※	знак за референция
⁂	звездички, три, три звездички
`	гравис, интонация, ударение
´	акут, интонация, ударение
^	V-образна стрелка, карета, контрол, показалец, сложно ударение, ударение, циркумфлекс
¨	трема, умлаут
°	градус, час
℗	авторско право, авторско право за звукозапис, запис, звук
←	наляво, сочеща наляво, стрелка, стрелка, сочеща наляво
↚	стрелка наляво и наклонена черта
→	надясно, сочеща надясно, стрелка, стрелка, сочеща надясно
↛	стрелка надясно и наклонена черта
↑	нагоре, сочеща нагоре, стрелка, стрелка, сочеща нагоре
↓	надолу, сочеща надолу, стрелка, стрелка, сочеща надолу
↜	вълнообразна стрелка наляво
↝	вълнообразна стрелка надясно
↞	стрелка наляво с двойна глава
↟	стрелка нагоре с двойна глава
↠	стрелка надясно с двойна глава
↡	стрелка надолу с двойна глава
↢	стрелка наляво с опашка
↣	стрелка надясно с опашка
↤	стрелка наляво с права опашка
↥	стрелка нагоре с права опашка
↦	стрелка надясно с права опашка
↧	стрелка надолу с права опашка
↨	вертикална двупосочна стрелка с основа
↫	завъртяна стрелка наляво
↬	завъртяна стрелка надясно
↭	вълнообразна двупосочна стрелка
↯	зигзаг, зигзагообразна стрелка надолу
↰	сочеща наляво, стрелка нагоре с глава, стрелка нагоре с глава, сочеща наляво
↱	сочеща надясно, стрелка нагоре с глава, стрелка нагоре с глава, сочеща надясно
↲	сочеща наляво, стрелка надолу с глава, стрелка надолу с глава, сочеща наляво
↳	сочеща надясно, стрелка надолу с глава, стрелка надолу с глава, сочеща надясно
↴	сочеща надолу, стрелка надясно, стрелка надясно, сочеща надолу
↵	сочеща наляво, стрелка надолу, стрелка надолу, сочеща наляво
↶	горна полукръгла стрелка, горна полукръгла стрелка, обратна на часовниковата, обратна на часовниковата
↷	горна полукръгла стрелка, горна полукръгла стрелка, по часовниковата, по часовниковата
↸	сочеща на северозапад стрелка с дълга черта
↹	стрелка наляво с черта над стрелка надясно с черта
↺	обратна на часовниковата, стрелка с отворен кръг, стрелка с отворен кръг, обратна на часовниковата
↻	по часовниковата, стрелка с отворен кръг, стрелка с отворен кръг, по часовниковата
↼	стрелка наляво с полових връх отгоре
↽	стрелка наляво с полових връх отдолу
↾	половин връх, стрелка нагоре с половин връх отдясно
↿	половин връх, стрелка нагоре с половин връх отляво
⇀	половин връх, стрелка надясно с половин връх отгоре
⇁	половин връх, стрелка надясно с половин връх отдолу
⇂	половин връх, стрелка надолу с половин връх отдясно
⇃	половин връх, стрелка надолу с половин връх отляво
⇄	стрелка надясно над стрелка наляво
⇅	нагоре, надолу, сочещи нагоре и надолу, стрелка, стрелки, стрелки, сочещи нагоре и надолу
⇆	надясно, наляво, сочеща наляво стрелка над сочеща надясно стрелка, стрелка
⇇	чифт стрелки наляво
⇈	чифт стрелки нагоре
⇉	чифт стрелки надясно
⇊	чифт стрелки надолу
⇋	стрелка наляво с половин връх над стрелка надясно с половин връх
⇌	стрелка надясно с половин връх над стрелка наляво с половин връх
⇐	двойна стрелка наляво
⇍	зачеркната двойна стрелка наляво
⇑	двойна стрелка нагоре
⇒	двойна стрелка надясно
⇏	зачеркната двойна стрелка надясно
⇓	двойна стрелка надолу
⇔	двойна лява и дясна стрелка
⇎	зачеркната двойна лява и дясна стрелка
⇖	сочеща на северозапад двойна стрелка
⇗	сочеща на североизток двойна стрелка
⇘	сочеща на югоизток двойна стрелка
⇙	сочеща на югозапад двойна стрелка
⇚	тройна стрелка наляво
⇛	тройна стрелка надясно
⇜	стрелка наляво със завъртулка
⇝	стрелка надясно със завъртулка
⇞	стрелка нагоре с две напречни черти
⇟	стрелка надолу с две напречни черти
⇠	пунктирана стрелка наляво
⇡	пунктирана стрелка нагоре
⇢	пунктирана стрелка надясно
⇣	пунктирана стрелка надолу
⇤	стрелка наляво с черта
⇥	стрелка надясно с черта
⇦	празна стрелка наляво
⇧	празна стрелка нагоре
⇨	празна стрелка надясно
⇩	празна стрелка надолу
⇪	празна стрелка нагоре, празна стрелка нагоре, разделена с черта, разделена с черта
⇵	стрелка надолу отляво и стрелка нагоре
∀	всеки, всички, даден, за всички, универсален
∂	диференциален, частичен диференциален
∃	съществува
∅	математика, оператор на множество, празно множество
∆	промяна, триъгълник
∇	набла, триъгълник
∈	елемент, елемент на, множество, принадлежност, съдържа
∉	елемент, не е елемент
∋	елемент, съдържа като член
∎	qed, край на доказателство, надгробен камък, халмос
∏	Декартово произведение, логика, произведение
∑	математика, сбор при n-арност
+	добавяне, знак плюс, плюс, събиране
±	плюс-минус
÷	деление, делено, знак за деление, обелос
×	знак за умножение, по, умножение, умножено
<	отварящ таг, по-малко от, таг
≮	математика, не по-малко от, неравенство
=	равенство, равно, равно на
≠	не равно, неравенство, различие
>	затварящ таг, по-голямо от, таг
≯	математика, не по-голямо от, неравенство
¬	не, отрицание
|	вертикална линия, вертикална черта, линия, перпендикуляр, черта, щрих, щрих на Шефер
~	тилда
−	знак минус, изваждане, минус
⁻	горен индекс, горен минус, минус
∓	минус или плюс, плюс-минус
∕	виргула, наклонена черта, наклонена черта за деление
⁄	виргула, дробна наклонена черта, наклонена черта
∗	звезда, оператор астериск
∘	композиция, оператор, оператор пръстен
∙	оператор, оператор водещ символ
√	ирационално число, квадратен корен, корен, на квадрат, радикал, радикс
∝	пропорционален, пропорционалност
∞	безкрайност, знак за безкрайност
∟	математика, прав ъгъл
∠	остър, ъгъл
∣	делител, разделя
∥	успореден
∧	клин, логическо и
∩	множество, пресичане
∪	множество, обединение, съвкупност
∫	интеграл, математически анализ
∬	двоен интеграл, математически анализ
∮	контурен интеграл
∴	логика, следователно
∵	защото, логика
∶	съотношение
∷	пропорционалност, пропорция
∼	оператор, оператор тилда
∽	обърната тилда, тилда
∾	обърната легнала буква s
≃	асимптота, асимптотично равен, математика
≅	еднаквост, изоморфизъм, математика, приблизително равен
≈	близко до, приблизително, приблизително равно
≌	всички равни, математика, равенство
≒	приблизително равен на образа
≖	математика, пръстен в знак за равенство, равенство
≡	еквивалентно на, идентично, точно, три черти
≣	математика, равенство, строго еквивалентен
≤	неравенство, по-малко или равно, по-малко от, равенство, равно на
≥	неравенство, по-голямо или равно, по-голямо от, равенство, равно на
≦	математика, неравенство, по-малко над равно
≧	математика, неравенство, по-голямо над равно
≪	математика, много по-малко от, неравенство
≫	математика, много по-голямо от, неравенство
≬	между
≳	еквивалентен на по-голямо, математика, неравенство
≺	математика, оператор на множество, предхожда
≻	математика, оператор на множество, следва
⊁	математика, не следва, оператор на множество
⊂	множество, подмножество, подмножество на
⊃	математика, надмножество, оператор на множество
⊆	равен на подмножество
⊇	математика, равен на надмножество, равенство
⊕	плюс, плюс в окръжност
⊖	минус в окръжност, симетрична разлика
⊗	знак за умножение в окръжност, произведение, тензор
⊘	математика, наклонена черта за деление в окръжност
⊙	XNOR, оператор, оператор точка в окръжност
⊚	оператор пръстен в окръжност
⊛	астериск, оператор, оператор астериск в окръжност
⊞	математика, плюс в квадрат
⊟	математика, минус в квадрат
⊥	горен так, так, фалш
⊮	не налага
⊰	математика, оператор на множество, предхожда при връзка
⊱	математика, оператор на множество, следва при връзка
⋭	математика, не съдържа като равен на нормална подгрупа, теория на групите
⊶	оригинален
⊹	Ерметиева конюгатна матрица, Ерметиева матрица, квадратва матрица, математика
⊿	математика, правоъгълен триъгълник
⋁	дизюнкция, логика, логическо или при n-арност
⋂	математика, оператор на множество, сечение при n-арност
⋃	математика, обединение, обединение при n-арност, оператор на множество
⋅	оператор, оператор точка
⋆	оператор, оператор звезда
⋈	двоичен оператор, естествено съединение
⋒	двойно сечение, математика, оператор на множество, сечение
⋘	изключително по-малко от, математика, неравенство
⋙	изключително по-голямо от, математика, неравенство
⋮	вертикално многоточие, математика, многоточие
⋯	многоточие, средно хоризонтално многоточие
⋰	математика, многоточие, сочещо нагоре и надясно диагонално многоточие
⋱	математика, многоточие, сочещо надолу и надясно диагонално многоточие
■	запълнен квадрат
□	празен квадрат
▢	празен квадрат със заоблени ръбове
▣	празен квадрат, празен квадрат, съдържащ запълнен квадрат, съдържащ запълнен квадрат
▤	квадрат с хоризонтално запълване
▥	квадрат с вертикално запълване
▦	квадрат с ортогонално щриховано запълване
▧	квадрат със запълване горе вляво и долу вдясно
▨	квадрат със запълване горе вдясно и долу вляво
▩	квадрат с диагонално щриховано запълване
▬	запълнен правоъгълник
▭	празен правоъгълник
▮	запълнен вертикален правоъгълник
▰	запълнен успоредник
▲	запълнен триъгълник, запълнен триъгълник, сочещ нагоре, запълнено, нагоре, сочещ нагоре, стрелка, триъгълник
△	сочещ нагоре празен триъгълник
▴	сочещ нагоре запълнен малък триъгълник
▵	сочещ нагоре празен малък триъгълник
▷	сочещ надясно празен триъгълник
▸	сочещ надясно запълнен малък триъгълник
▹	сочещ надясно празен малък триъгълник
►	сочещ надясно запълнен показалец
▻	сочещ надясно празен показалец
▼	запълнен триъгълник, запълнен триъгълник, сочещ надолу, запълнено, надолу, сочещ надолу, стрелка, триъгълник
▽	сочещ надолу празен триъгълник
▾	сочещ надолу запълнен малък триъгълник
▿	сочещ надолу празен малък триъгълник
◁	сочещ наляво празен триъгълник
◂	сочещ наляво запълнен малък триъгълник
◃	сочещ наляво празен малък триъгълник
◄	сочещ наляво запълнен показалец
◅	сочещ наляво празен показалец
◆	запълнен ромб
◇	празен ромб
◈	празен ромб, празен ромб, съдържащ запълнен ромб, съдържащ запълнен ромб
◉	концентрични окръжности, оградена точка, празна окръжност, празна окръжност, съдържаща запълнена окръжност, съдържаща запълнена окръжност
◊	диамант, ромб, ромбовиден
○	кръг, незапълнен кръг, празен кръг
◌	пунктирана окръжност
◍	окръжност с вертикално запълване
◎	двойна окръжност, концентрични окръжности, мишена
●	запълнен кръг, кръг
◐	окръжност със запълнена лява половина
◑	окръжност със запълнена дясна половина
◒	окръжност със запълнена долна половина
◓	окръжност със запълнена горна половина
◔	окръжност със запълнен горен десен квадрант
◕	запълнена окръжност с празен горен ляв квадрант
◖	запълнена отляво, окръжност, окръжност, запълнена отляво
◗	запълнена отдясно, окръжност, окръжност, запълнена отдясно
◘	обърнат водещ символ
◙	запълнен квадрат, запълнен квадрат, съдържащ празна окръжност, обърната празна окръжност, съдържащ празна окръжност
◜	кръгла дъга в горен ляв квадрант
◝	кръгла дъга в горен десен квадрант
◞	кръгла дъга в долен десен квадрант
◟	кръгла дъга в долен ляв квадрант
◠	горна полуокръжност
◡	долна полуокръжност
◢	запълнен триъгълник с прав ъгъл долу вдясно
◣	запълнен триъгълник с прав ъгъл долу вляво
◤	запълнен триъгълник с прав ъгъл горе вляво
◥	запълнен триъгълник с прав ъгъл горе вдясно
◦	празен водещ символ
◯	голям незапълнен кръг, кръг, празен кръг
◳	празен квадрат с горен десен квадрант
◷	празна окръжност с горен десен квадрант
◿	триъгълник с прав ъгъл долу вдясно
♪	музика, нота, осмина, осмина нота
⨧	плюс с две в долен индекс
